title,source
"Union Minister for Finance and Corporate Affairs Smt. Nirmala Sitharaman inaugurates SPMCIL's New Corporate Office at World Trade Centre, Nauroji Nagar, New Delhi, today",https://pib.gov.in/PressReleaseIframePage.aspx?PRID=2135268
Union Minister Dr L. Murugan inaugurates NeVA Digital Platform for Puducherry Legislative Assembly,https://pib.gov.in/PressReleaseIframePage.aspx?PRID=2135180
World today looks up to India to overcome the global challenges: Dr Jitendra Singh,https://pib.gov.in/PressReleaseIframePage.aspx?PRID=2135185
"The Consulate General of India celebrated the fifth Curtain Raiser for the International Day of Yoga 2025, in collaboration with the Brahma Kumaris a unique, spiritual, value-based educational institution at Perth, in Australia on June 09, 2025.",https://pib.gov.in/FrontPhotoGallery.aspx?CategoryId=185210
"Swami Vivekananda Cultural Centre (SVCC), Bali in collaboration with Genta Yoga Pemogan community in Denpasar organized the 36th pre-event of IDY2025. The session highlighted the power of connection, discipline, and tradition through a shared yoga practice, in Indonesia on June 09, 2025.",https://pib.gov.in/FrontPhotoGallery.aspx?CategoryId=185211
"The Union Minister for Finance and Corporate Affairs, Smt. Nirmala Sitharaman addressing at the Corporate Office of Security Printing and Minting Corporation of India (SPMCIL), followed by award ceremony, in New Delhi on June 09, 2025.",https://pib.gov.in/FrontPhotoGallery.aspx?CategoryId=185229
The Office of Principal Scientific Adviser to Government of India organised the first State/UTs engagement workshop under the National One Health Mission,https://pib.gov.in/PressReleaseIframePage.aspx?PRID=2135236
Earth Sciences Minister Dr. Jitendra Singh and the UNESCO emissary Vidar Helgesen hold bilateral with focus on conservation of oceans,https://pib.gov.in/PressReleaseIframePage.aspx?PRID=2135183
Lok Samvardhan Parv Commemorating Completion of 11 years of Government to begin tomorrow at Raj Ghat,https://pib.gov.in/PressReleaseIframePage.aspx?PRID=2135292
"The Minister of State for Finance, Shri Pankaj Chaudhary addressing at the Corporate Office of Security Printing and Minting Corporation of India (SPMCIL), followed by award ceremony, in New Delhi on June 09, 2025.",https://pib.gov.in/FrontPhotoGallery.aspx?CategoryId=185230
"The Minister of State for Finance, Shri Pankaj Chaudhary lighting the lamp at the Corporate Office of the Security Printing and Minting Corporation of India (SPMCIL), followed by award ceremony, in New Delhi on June 09, 2025. The Union Minister for Finance and Corporate Affairs, Smt. Nirmala Sitharaman also seen.",https://pib.gov.in/FrontPhotoGallery.aspx?CategoryId=185227
"The Union Minister of Communications and Development of North Eastern Region (DoNER), Shri Jyotiraditya M. Scindia addressing at unveil the theme for 9th Edition of India Mobile Congress 2025: ‘Innovate to Transform’ and launch the Student Volunteers led ‘Sanchar Mitra Scheme’ for citizen awareness, in New Delhi on May 26, 2025.",https://pib.gov.in/FrontPhotoGallery.aspx?CategoryId=184023
PM shares an article on how India's Technical Textiles Sector is witnessing rapid growth,https://pib.gov.in/PressReleaseIframePage.aspx?PRID=2135306
"The Minister of State for Road Transport and Highways and Corporate Affairs, Shri Harsh Malhotra lighting the lamp at Poshan Abhiyan, in Delhi on June 09, 2025.",https://pib.gov.in/FrontPhotoGallery.aspx?CategoryId=185195
"The Minister of State for Road Transport and Highways and Corporate Affairs, Shri Harsh Malhotra addressing at Poshan Abhiyan, in Delhi on June 09, 2025.",https://pib.gov.in/FrontPhotoGallery.aspx?CategoryId=185197
From Drafting Legislations to Saving Lives: Legislative Department Organizes Blood Donation Camp on World Blood Donor Day 2025,https://pib.gov.in/PressReleaseIframePage.aspx?PRID=2135243
Raksha Rajya Mantri visits Shimla-based Army Training Command,https://pib.gov.in/PressReleaseIframePage.aspx?PRID=2135241
Delhi Chief Minister meets Prime Minister,https://pib.gov.in/PressReleaseIframePage.aspx?PRID=2135330
"Following the announcement by Prime Minister Shri Narendra Modi regarding additional compensation for houses damaged in border areas, Union Home Minister Shri Amit Shah ensures swift action by facilitating an additional provision of ₹25 crore from the Ministry of Home Affairs for 2,060 houses",https://pib.gov.in/PressReleaseIframePage.aspx?PRID=2135226
"Prime Minister hails unprecedented growth of India's Defence sector in last 11 Years, strengthening Self-Reliance and Modernisation",https://pib.gov.in/PressReleaseIframePage.aspx?PRID=2135281
"During their port call in Chennai, the ships of Eastern Sword Sunrise Fleet experienced a rejuvenating yoga session, embracing holistic wellness. The session fostered harmony, resilience, and personal health, while promoting self-awareness and focus among the crew on June 10, 2025.",https://pib.gov.in/FrontPhotoGallery.aspx?CategoryId=185247
"The Embassy of India in Berlin, Germany and The Tagore Cultural Centre in Berlin, Germany held a calm and grounding yoga session in front of Berlin’s Reichstag - Germany’s historic Parliament building and a symbol of democracy and unity on June 09, 2025.",https://pib.gov.in/FrontPhotoGallery.aspx?CategoryId=185206
Union Commerce and Industry Minister Shri Piyush Goyal Engages with Swiss Industry to Deepen India–Switzerland Economic Partnership,https://pib.gov.in/PressReleaseIframePage.aspx?PRID=2135293
"The Union Minister for Finance and Corporate Affairs, Smt. Nirmala Sitharaman and The Minister of State for Finance, Shri Pankaj Chaudhary at the Corporate Office of Security Printing and Minting Corporation of India (SPMCIL), followed by award ceremony, in New Delhi on June 09, 2025.",https://pib.gov.in/FrontPhotoGallery.aspx?CategoryId=185234
"On the occasion of Harit Yoga, the spirited team of students, staff, and doctors of National Institute of Naturopathy, Pune embarked on a rejuvenating Yoga Trek to Sinhagad Fort blending the serenity of yoga with the strength of nature and the joy of togetherness on June 10, 2025.",https://pib.gov.in/FrontPhotoGallery.aspx?CategoryId=185249
"The Embassy of India in Berlin, Germany and The Tagore Cultural Centre in Berlin, Germany held a calm and grounding yoga session in front of Berlin’s Reichstag - Germany’s historic Parliament building and a symbol of democracy and unity on June 09, 2025.",https://pib.gov.in/FrontPhotoGallery.aspx?CategoryId=185204
"On the occasion of Harit Yoga, the spirited team of students, staff, and doctors of National Institute of Naturopathy, Pune embarked on a rejuvenating Yoga Trek to Sinhagad Fort blending the serenity of yoga with the strength of nature and the joy of togetherness on June 10, 2025.",https://pib.gov.in/FrontPhotoGallery.aspx?CategoryId=185248
"On the occasion of Harit Yoga, the spirited team of students, staff, and doctors of National Institute of Naturopathy, Pune embarked on a rejuvenating Yoga Trek to Sinhagad Fort blending the serenity of yoga with the strength of nature and the joy of togetherness on June 10, 2025.",https://pib.gov.in/FrontPhotoGallery.aspx?CategoryId=185250
"The Minister of State for Defence, Shri Sanjay Seth visited the Army Training Command (ARTRAC) based at Shimla, in Himachal Pradesh on June 09, 2025.",https://pib.gov.in/FrontPhotoGallery.aspx?CategoryId=185243
Shri Dharmendra Pradhan chairs Global Young Scientists Conference and Annual General Meeting of the Global Young Academy,https://pib.gov.in/PressReleaseIframePage.aspx?PRID=2135357
"The Embassy of India in Berlin, Germany and The Tagore Cultural Centre in Berlin, Germany held a calm and grounding yoga session in front of Berlin’s Reichstag - Germany’s historic Parliament building and a symbol of democracy and unity on June 09, 2025.",https://pib.gov.in/FrontPhotoGallery.aspx?CategoryId=185205
Union Agriculture Minister Shri Shivraj Singh Chouhan Meets Farmers in Telangana,https://pib.gov.in/PressReleaseIframePage.aspx?PRID=2135232
"The Union Minister for Finance and Corporate Affairs, Smt. Nirmala Sitharaman and The Minister of State for Finance, Shri Pankaj Chaudhary to inaugurate the Corporate Office of the Security Printing and Minting Corporation of India (SPMCIL), followed by award ceremony, in New Delhi on June 09, 2025.",https://pib.gov.in/FrontPhotoGallery.aspx?CategoryId=185224
"The Minister of State for Defence, Shri Sanjay Seth visited the Army Training Command (ARTRAC) based at Shimla, in Himachal Pradesh on June 09, 2025.",https://pib.gov.in/FrontPhotoGallery.aspx?CategoryId=185244
PM shares an article highlighting India’s Digital Connectivity Revolution in last 11 years,https://pib.gov.in/PressReleaseIframePage.aspx?PRID=2135354
BHASHINI and CRIS Sign MoU to Build Next-Gen Multilingual AI Solutions for Indian Railways,https://pib.gov.in/PressReleaseIframePage.aspx?PRID=2135178
PM shares an article highlighting expansion of India's sports infrastructure in last 11 years,https://pib.gov.in/PressReleaseIframePage.aspx?PRID=2135308
"The Minister of State for Road Transport and Highways and Corporate Affairs, Shri Harsh Malhotra addressing at Poshan Abhiyan, in Delhi on June 09, 2025.",https://pib.gov.in/FrontPhotoGallery.aspx?CategoryId=185198
KEEL LAYING OF FOURTH EX-GSL NGOPV (YARD 1283),https://pib.gov.in/PressReleaseIframePage.aspx?PRID=2135188
"Union Minister for Finance and Corporate Affairs Smt. Nirmala Sitharaman chairs 6th meeting of the Governing Council of National Investment and Infrastructure Fund (NIIF) in New Delhi, today",https://pib.gov.in/PressReleaseIframePage.aspx?PRID=2135239
